{
  "$schema": "http://json-schema.org/draft-07/schema#",
  "title": "IPSC Kurs Watcher Configuration",
  "type": "object",
  "required": ["version", "monitors", "filters", "notifiers", "state", "logging"],

  "properties": {
    "version": {
      "type": "integer",
      "description": "Config schema version",
      "minimum": 1
    },

    "monitors": {
      "type": "array",
      "description": "Monitor configurations for different websites",
      "minItems": 1,
      "items": {
        "type": "object",
        "required": ["id", "provider", "enabled", "url", "base_url"],
        "properties": {
          "id": {
            "type": "string",
            "description": "Unique monitor identifier"
          },
          "provider": {
            "type": "string",
            "description": "Provider type (e.g., 'shooting-store')"
          },
          "enabled": {
            "type": "boolean",
            "description": "Whether monitor is active"
          },
          "url": {
            "type": "string",
            "format": "uri",
            "description": "Target URL to monitor"
          },
          "base_url": {
            "type": "string",
            "format": "uri",
            "description": "Base URL for constructing detail page links"
          },
          "timeout_seconds": {
            "type": "integer",
            "default": 30,
            "minimum": 1,
            "description": "HTTP request timeout"
          },
          "retry_attempts": {
            "type": "integer",
            "default": 3,
            "minimum": 1,
            "description": "Number of retry attempts on failure"
          },
          "poll_interval_minutes": {
            "type": "integer",
            "default": 30,
            "minimum": 5,
            "description": "Polling interval in minutes"
          }
        }
      }
    },

    "filters": {
      "type": "object",
      "description": "Filtering rules for courses",
      "required": ["course_types", "exclude_patterns"],
      "properties": {
        "course_types": {
          "type": "array",
          "description": "Course type filters",
          "items": {
            "type": "object",
            "required": ["id", "name", "patterns"],
            "properties": {
              "id": {
                "type": "string",
                "description": "Filter ID"
              },
              "name": {
                "type": "string",
                "description": "Display name"
              },
              "patterns": {
                "type": "array",
                "items": {
                  "type": "string"
                },
                "description": "Match patterns (regex or literal)"
              },
              "enabled": {
                "type": "boolean",
                "default": true,
                "description": "Whether filter is active"
              }
            }
          }
        },
        "exclude_patterns": {
          "type": "array",
          "items": {
            "type": "string"
          },
          "description": "Patterns to exclude from results"
        },
        "min_availability": {
          "type": "integer",
          "default": 1,
          "minimum": 0,
          "description": "Minimum available slots to alert"
        }
      }
    },

    "notifiers": {
      "type": "object",
      "description": "Notification channel configurations",
      "properties": {
        "windows_toast": {
          "type": "object",
          "description": "Windows Toast notifications (v0.1)",
          "properties": {
            "enabled": {
              "type": "boolean",
              "default": true,
              "description": "Enable/disable Toast notifications"
            },
            "sound_enabled": {
              "type": "boolean",
              "default": true,
              "description": "Play sound on Toast notification"
            },
            "group_by_type": {
              "type": "boolean",
              "default": true,
              "description": "Group alerts by type (NEW, REDUCED, SOLD_OUT)"
            },
            "max_courses_per_group": {
              "type": "integer",
              "default": 5,
              "minimum": 1,
              "maximum": 10,
              "description": "Maximum courses per Toast notification"
            },
            "auto_dismiss_seconds": {
              "type": "integer",
              "default": 5,
              "minimum": 3,
              "maximum": 15,
              "description": "Seconds before Toast auto-dismisses"
            },
            "main_page_url": {
              "type": "string",
              "format": "uri",
              "description": "URL to open when Toast is clicked"
            }
          }
        },
        "email": {
          "type": "object",
          "description": "Email notifications (v0.1 planned)",
          "properties": {
            "enabled": {
              "type": "boolean",
              "default": false,
              "description": "Enable/disable email notifications"
            },
            "smtp_host": {
              "type": "string",
              "description": "SMTP server hostname"
            },
            "smtp_port": {
              "type": "integer",
              "minimum": 1,
              "maximum": 65535,
              "description": "SMTP server port"
            },
            "use_tls": {
              "type": "boolean",
              "default": true,
              "description": "Use TLS/SSL for SMTP"
            },
            "from_address": {
              "type": "string",
              "format": "email",
              "description": "Sender email address"
            },
            "from_display_name": {
              "type": "string",
              "description": "Sender display name"
            },
            "smtp_user": {
              "type": "string",
              "description": "SMTP authentication username"
            },
            "smtp_password": {
              "type": "string",
              "description": "SMTP authentication password (stored encrypted via DPAPI)"
            },
            "recipients": {
              "type": "array",
              "items": {
                "type": "string",
                "format": "email"
              },
              "description": "Email recipient addresses (primary + BCC)"
            },
            "retry_attempts": {
              "type": "integer",
              "default": 3,
              "minimum": 1,
              "description": "SMTP retry attempts"
            },
            "timeout_seconds": {
              "type": "integer",
              "default": 30,
              "minimum": 5,
              "description": "SMTP connection timeout"
            },
            "template_file": {
              "type": "string",
              "description": "Path to HTML email template"
            }
          }
        },
        "discord": {
          "type": "object",
          "description": "Discord webhook notifications (v0.1 planned)",
          "properties": {
            "enabled": {
              "type": "boolean",
              "default": false,
              "description": "Enable/disable Discord notifications"
            },
            "webhook_urls": {
              "type": "array",
              "items": {
                "type": "string",
                "format": "uri"
              },
              "description": "Discord webhook URLs (can be multiple channels)"
            },
            "mention_on_new": {
              "type": "boolean",
              "default": true,
              "description": "Mention user/role when NEW courses detected"
            },
            "mention_user_id": {
              "type": ["string", "null"],
              "description": "Discord user ID to mention (optional)"
            },
            "mention_role_id": {
              "type": ["string", "null"],
              "description": "Discord role ID to mention (optional)"
            },
            "include_url_buttons": {
              "type": "boolean",
              "default": true,
              "description": "Include clickable course URL buttons"
            },
            "retry_attempts": {
              "type": "integer",
              "default": 3,
              "minimum": 1,
              "description": "Webhook retry attempts"
            },
            "timeout_seconds": {
              "type": "integer",
              "default": 30,
              "minimum": 5,
              "description": "Webhook request timeout"
            }
          }
        }
      }
    },

    "state": {
      "type": "object",
      "description": "State management settings",
      "required": ["file_path"],
      "properties": {
        "file_path": {
          "type": "string",
          "description": "Path to state.json file"
        },
        "retention_days": {
          "type": "integer",
          "default": 30,
          "minimum": 1,
          "description": "Days to retain state history"
        }
      }
    },

    "logging": {
      "type": "object",
      "description": "Logging configuration",
      "required": ["log_dir"],
      "properties": {
        "log_dir": {
          "type": "string",
          "description": "Directory for log files"
        },
        "log_level": {
          "type": "string",
          "enum": ["DEBUG", "INFO", "WARN", "ERROR"],
          "default": "INFO",
          "description": "Minimum log level"
        },
        "retention_days": {
          "type": "integer",
          "default": 30,
          "minimum": 1,
          "description": "Days to retain logs"
        },
        "format": {
          "type": "string",
          "enum": ["json", "text"],
          "default": "json",
          "description": "Log output format"
        }
      }
    },

    "error_handling": {
      "type": "object",
      "description": "Error handling and resilience settings",
      "properties": {
        "alert_on_repeated_errors": {
          "type": "boolean",
          "default": false,
          "description": "Alert after repeated errors"
        },
        "error_threshold": {
          "type": "integer",
          "default": 5,
          "minimum": 1,
          "description": "Number of errors before alerting"
        },
        "error_window_minutes": {
          "type": "integer",
          "default": 60,
          "minimum": 1,
          "description": "Time window for error counting"
        }
      }
    }
  }
}
